etd_file_id,text
134,"['THE MEDIEVAL MUSLIM ATTITUDE TOWARD YOUTH', 'After an attempt to determine the age limits Muslim authors', 'set for youth, this study concentrates on the physical, intellectual,', 'political, moral, and social qualities of youth as viewed in medieval', 'Islam. It also deals with the subject of rejuvenation, in this life', 'and in Paradise.', 'Medieval Muslimsculture associated youth with black hair, spring,', 'beauty, vigor, and health. It attributed to the young inexperience,', 'ignorance, and all kinds of folly and to the old experience, wisdom', 'and knowledge, maturity and dignity. Accordingly, the young had a low', 'political, moral, and social status. They were not considered to be', 'fit for leadership or worthy of respect and consideration. Keeping', 'company with the young was not suitable for a political leader and', 'might even by dangerous. Some authors tried to show that this popular', 'conception of youth was not necessarily a valid one, but they were few.', 'Moralists saw in youth the least desirable stage of life because', 'it was conducive to the commission of sins. However, there was a', 'strong and pervasive feeling that youth was, in fact, the most precious', 'asset given to man, and its glory was extolled, or its passing mourned,', 'in innumerable statements in poetry and prose.', 'Reproduced with permission of the copyright owner. Further reproduction prohibited without permission.']"
135,"['SUMMARY', 'Five different methods were used to examine cell contact behavior', 'in normal and hybrid amphibian embryos in an attempt to elucidate the', 'role of cell surface adhesiveness in gastrulation. The results, summar-', 'ized for each type of embryo, are as follows. 1.) pipiens-pipiens- In', 'this normal embryo, prior to gastrulation, all cells show an increasing', 'tendency to attach to glass substrata in vitro with advancing develop-', 'mental age, Dissociated presumptive mesodermal cells from early gastrulae', 'show a high ability to attach to glass and to reaggregate. The rates:óf', 'disaggregation of whole embryos show marked decreases with advancing', 'age from the blastula to late gastrula period. Binary combinations of', 'explanted embryonic germ layer fragments from early gastrulae undergo', 'movements that are in part reminiscent of portions of gastrulation.', 'At the level of fine structure, presumptive ectodermal cells form cell', 'contacts which become increasingly intimate, as judged by closer apposi-', 'tion of plasma membranes and overlapping filopodia, from the blastula', 'to the late gastrula period. Presumptive mesodermal cells in early', 'gastrulae have numerous close cell contacts and some tight junctions.', '2.) pipiens-palustris- This viable hybrid embryo, which occasionally', 'shows slight abnormality in invagination, is quite similar to pipiens-', 'pipiens in all respects. Slight alterations in cell contact behavior', 'correlate positively with slight abnormalities in gastrulation. 3.)', 'pipiens-sylvatica- This hybrid undergoes a moderately severe develop-', 'mental arrest at the onset of gastrulation. During a short time, when', 'controls are undergoing epiboly, a severe wrinkling appears in the', 'roof of the blastocoel. No extensive invagination or archenteron form-', 'ation occurs. Animal cells show an increase in frequency of attachment', 'while vegetal cells show none. Rates of disaggregation decrease moder-', 'ately with advancing age. Explanted fragments show movements similar', 'to those seen in normal fragment combinations. Presumptive mesodermal', 'cells have a low frequency of attachment, moderately reduced ability to', 'reaggregate, moderately increased separation between plasma membranes,', 'and no tight junctions. 4.) pipiens-catesbeiana- This embryo undergoes', 'a severe developmental arrest at the onset of gastrulation. Little or', 'no increase in frequency of attachment occurs in any cells. All stages', 'disaggregate rapidly. Explanted fragments show no movements. Presump-', 'tive mesodermal cells have a low frequency of attachment, very little', 'ability to reaggregate, moderately increased separation between plasma', 'membranes, and no tight junctions. At the level of fine structure, pre-', 'sumptive ectodermal cells do not form increasingly intimate contacts.', '5.) pipiens-clamitans- This hybrid undergoes the most severe arrest at', 'the onset of gastrulation. No increase in frequency of attachment occurs', 'in any cells. Disaggregation rates remain high at all stages. Explanted', 'fragments show no movements. Presumptive mesodermal cells have a low', 'frequency of attachment, no ability to reaggregate, grossly increased', 'separation between plasma membranes, and no tight junctions. These', 'results indicate that extent of increase in cell surface adhesiveness', 'and extent of normal gastrulation correlate positively. This suggests', 'that increased cell surface adhesiveness is necessary for the morpho-', 'genetic movements of gastrulation.', 'Reproduced with permission of the copyright owner. Further reproduction prohibited without permission.']"
136,"['ABSTRACT', 'The amount of L-asparagine and L-aspartic acid produc- -', 'tion by intact cells was determined by an enzymatic assay.', 'L-Asparaginase resistant murine tumor cells produced 1.0-', '1.6 nmoles L-asparagine/mg of cells/hour while sensitive', 'tumor cells produced less than 0.1 nmole /mg of cells/', 'hour. The newly synthesized L-aspartic acid was largely', 'localized in the cells; the newly synthesized L-asparagine,', 'however, distributed both in the cells and in the medium.', 'The L-asparagine analogs DONV (0.5 mM) and CONV (0.05 mM)', 'inhibited L-asparagine production 86% and 95% respectively;', 'no concurrent inhibition of L-aspartic acid production was', 'observed.', 'The purification (305-fold) and characterization of L-', 'asparagine synthetase from one of the L-asparaginase resis-', 'tant tumors, 6C3HED-RG1, is described. Initial velocity', 'studies and product inhibition studies suggest that L-', 'glutamine interacted with free L-asparagine synthetase and', 'released L-glutamic acid, the aminated enzyme then reacted', 'with ATP to release pyrophosphate and form an aminated and', 'adenylated enzyme. The resultant modified enzyme then', 'appears to react with L-aspartic acid to release AMP and L-', 'asparagine. The proposed mechanism was supported by alter-', 'nate substrate studies and reversibility studies. Dead-end', 'inhibition studies with L-asparagine analogs indicated that', 'DONV competed with the L-glutamine or L-asparagine site on', 'the free enzyme, and that CONV interacted with two or more', 'stable enzyme forms.', 'L-Asparagine synthetase catalyzed a reaction with three', 'substrates and four products, a Ter-Quad system according to', ""Cleland's notation. Mathematical approaches have been used"", '-to analyze the possible kinetic patterns and mechanisms in', ""Cleland's graphical model. Several general equations were"", 'derived to express the overall number of patterns and mechan-', 'isms at any number of substrates and products; and to express', 'the specific number of patterns and mechanisms at any number', 'of substrates, products and stable enzyme forms. The number', 'of different mechanisms at S substrates, P products and n', 'stable enzyme forms is given by', 's-1', 'd P -1', 'd', 'n-1', 'n - -1', 'd', 'd', 'where d is summed over the common divisors of s, P and n;', 'and', ""is Euler's totient function."", 'Reproduced with permission of the copyright owner. Further reproduction prohibited without permission.']"
137,"['SUMMARY', 'The dissertation develops a qualitative model which describes', 'the political interaction discovered in the municipal budgetary', 'processes of four medium-size cities. The cities are: Milford', 'and Bridgeport, Connecticut; and Chicopee and Springfield,', 'Massachusetts. The model is based on ninety-four intensive', 'interviews with various budgetary participants and citizens in the', 'four cities. The interviews were conducted during June to', 'November, 1968.', 'After summarizing prior approaches to municipal budgeting', 'and describing the four cities, a four stage budgetary process', 'is developed. This process, made up of the formulation, review,', 'decision, and expenditure stages, was used to structure and organize', 'the research. Ninety-four interviews were held with a variety of', 'budgetary participants and citizens in the four cities. Participant', 'behavior was then analyzed for each of the four stages of the', 'budgetary process. These results are summarized and form the', 'basis for the model development.', 'The last chapter summarizes the major findings and compares', 'them to other research results in the budgetary field. Significant', 'differences are found. The most important of these centers on the', 'role of political and informal behavior manifested during the', 'budgetary research. Extensive political and informal behavior was', 'found in all four cities. Budgetary participants described instances', 'of informal interaction during each stage of the budgetary process.', 'The possible explanations for this behavior are then offered. After', 'two process models depicting informal interaction and change are', 'presented, four recommendations are made pertaining to the direction', 'of future research efforts in the budgetary field.', 'Reproduced with permission of the copyright owner. Further reproduction prohibited without permission.']"
139,"['ORGANOSILICON- AND ORGANOGERMANIUM-NITROG COMPOUNDS', 'Alan H. Bates', 'May, 1970', 'E.G. Rochow, Advisor', 'Summary', 'Organosilicon chemistry has been refined until it has become', 'possible to generalize somewhat and predict the behavior of the', 'silicon-oxygen or silicon-nitrogen bond under different circum-', 'stances. Such thorough study has not characterized organogerman-', 'ium chemistry. Particularly within the much neglected area of', 'organogermanium-nitrogen chemistry, too f wew compounds have been', 'prepared to permit ell-founded generalization about bonding.', 'In this research, a number of new organogermanium-nitroge', 'compounds were characterized, primarily for purposes of comparison', 'with related silazanes and silylamines. A consistent goal was', 'to prepare compounds with low moisture sensitivity. Character-', 'ization of N-pheny1 and N-cyclohexy1 organogermazanes by NMR,', 'IR, mass spectrometry, and elemental analysis added to what little', 'had been known, particularly spectroscopically, about organo-', 'germanium-nitrogen compounds. One noted some differences in the', 'reactions of dimethyldichlorosilane and dimethyldichlorogerman', 'with aromatic amines like aniline. The germazane products were', 'monomers or six- and eight-membered heterocycles, rather than', 'linear polymers.', 'New linear silylamine and cross-linked germylamine polymers', 'were prepared by reaction of dimethyldichlorosilane and dimethy1-', 'dichlorogermane with the three isomeric xylylenediamines, The', 'NMR spectra of these materials furnished readily interpretable', ""compounds. The N,N'-bis-(trimethylsily1) and N,N'-bis-(trimethy1-"", 'contrasts yith the spectra of the previously known ethylenediamine', 'germy1) derivatives of 0-, m-, and p-xylylenediamine were also', 'characterized fully.', 'The bis-(trimethylsily1) derivative of 2,3-dihydrophthalazine-', '1,4-dione has been tentatively shown to involve Si-N rather than', 'Si-o bonding. NMR spectra suggested that at room temperature', 'rotation of the trimethy1sily1 groups is hindered in this compound.', 'Low molecular weight polymers formed from 2,3-dihydrophthalazine-', ',4-dione and limethyldichlorosilane or dimethyldichlorogermane', 'have been characterized.', 'Kummer and E.G. Rochow, Inorg. Chem., 4, 1450(1965).', 'F.A. Henglein and K. Lienhard, Makromol. Chem., 32, 218(1959).', 'Reproduced with permission of the copyright owner. Further reproduction prohibited without permission.']"
140,"['STRUCTURAL AND MOLECULAR ORBITAL STUDIES OF CARBORANES', '(a Summary)', 'Research Director:', 'Thomas F. Koetzle', 'Professor W. N. Lipscomb', 'November 1969', 'The crystal and molecular structures of', 'and 2 have been deter- -', 'mined by three-dimensional x-ray diffraction studies', 'at low temperatures. In each case, atomic positions', 'are elucidated by application of direct methods of', 'phase determination. The resulting molecular geometries', 'provide the basis for theoretical investigations by', 'both the extended Hückel and non-empirical molecular', 'orbital methods.', 'The desire for better carborane wavefunctions has', 'led us to perform accurate minimum basis set SCF', 'calculations for the two isomers of B Parameters', 'from these SCF results have been used in the calcula-', 'tion of non-empirical molecular orbitals for several', 'carboranes in the series BN°2HN+2 Energies, ionization', 'potentials, charge distributions, and dipole moments', 'are tabulated.', 'Reproduced with permission of the copyright owner. Further reproduction prohibited without permission.']"
141,"['Stereoselectivity in the Thermal Rearrangement of an', 'Optically Active Me >thylenecyclobutane', 'Summary', 'Research Director', 'Eric Thor Fossel', 'W. von E. Doering', 'February 1970', 'Optically active dimethyl cis and trans 3-methylene-', 'cyclobutane-1,2-dicarboxylate - (cis-l and trans-I) were found', 'to rearrange to optically active methy1 3-carbomethoxycyclo-', 'but-1-ylidene-acetate (III). The specific rotations of op-', 'tically pure cis-I, trans-I and III were ascertained revealing', 'that III from the rearrangement of cis-I contained 75% of the', 'optical purity of the starting material and that III from the', 'rearrangement of trans-I contained 33% of the optical purity', 'of the starting material.', 'For the transformation of cis-I to III to occur,', 'COOMe', 'MeOOC', 'H', 'MeOOC', '2', '3', 'COOMe', 'H', 'I', '4', 'H', 'III', 'H', 'cis-I', 'it is necessary that, in the diradical intermediate, the', 'C2-C3 bond rotate 90°. The C1-C4 bond may undergo no ro-', 'tation (0) or it may rotate 180° during the rearrangement.', 'Examination of the NMR spectrum of the rearrangement product', 'Reproduced with permission of the copyright owner. Further reproduction prohibited without permission.'] ['of optically active dimethyl cis-3-dideuteriomethylenecyclo- -', 'butane- - 1,2-dicarboxylate and determination of the absolute', 'configurations of cis-] and III revealed that rotation of the', 'C2-C3 bond always occurs in such a way as to place the carbo-', 'methoxy group syn to the CH2 group which had constituted', 'the methylene group of starting material and that 87% of the', 'product is formed by a 0° rotation of the C1-C4 bond while', '13% is formed by a 180° rotation.', 'Reproduced with permission of the copyright owner. Further reproduction prohibited without permission.']"
143,"['xviii', 'SUMMARY', 'The objective of this investigation is to study the flow conditions', 'in shaft spillways in order to develop design information.', 'An extensive review of literature of vertical-shaft spillways is', 'presented. The horizontal conduit is designed to flow partly full at all', 'discharges, since the transition from partly-full to full-pipe flow (seal-', 'ing) is accompanied by vibrations of the structure and surging of the', 'flow. The major effort of this investigation was to determine experi-', 'mentally the flow conditions associated with incipient sealing in the', 'horizontal leg of the spillway.', 'The experimental study was done in a 4 in.-by-4 in. square conduit', 'with three different circular bends, with various deflectors, and with', 'various concentrations of air admitted with the water falling down the', 'vertical shaft.', 'Sealing depends on the Froude number of the flow in the horizontal', 'conduit. To maintain partly-full flow, more space is needed above the', 'water-flow area with an increase of Froude number. With short-tube', 'control, the ratio of the radius of curvature along the centerline to', 'the bend diameter, I/Df , and the deflector thickness at the crown of', 'the bend determine the water-flow area in the horizontal conduit.', 'Ventilation of the conduit delays sealing while aeration of the water', 'flow hastens sealing. With weir control, waves on the flow surface', 'hastens sealing and highly aerated flow delay sealing. Ratios of radius', 'of curvature along the centerline to the bend diameter, I/D larger', 'Reproduced with permission of the copyright owner. Further reproduction prohibited without permission.'] ['xix', 'than 2.0 are recommended, since bends of larger ratios of I/D generate', 'less waves.', 'A general discussion on shaft spillways is presented covering:', 'vertical versus inclined shaft spillways, free versus submerged inlet,', 'partly-full versus full conduit, conduit-size determination, bend curva-', 'ture, and air demand. Design examples are also presented.', 'The results of this study are not aimed to eliminate the need', 'of model studies but rather to enable the designer to make better initial', 'designs.', 'Reproduced with permission of the copyright owner. Further reproduction prohibited without permission.']"
144,"['ix', 'SUMMARY', 'The purpose of this research was to study the reaction of hydro- -', 'carbons with atomic oxygen; the major emphasis was placed on product', 'determination and reaction rates. The majority of work concerned the', 'oxidation of aromatic compounds with ground state atomic oxygen, o(³P).', 'The experimental technique of choice was the mercury photosensitized', 'decomposition of nitrous oxide at 2537A; a flow system at atmospheric', 'pressure and 30°C was found to be convenient for most aromatic com-', 'pounds studied. The compounds successfully oxidized were: benzene,', 'toluene, ethylbenzene, tert-butylbenzene, ortho; meta-and para-xylene,', 'mesitylene, 1, 2,3-trimethylbenzene, anisole, fluorobenzene, benzotri-', 'fluoride and nitrobenzene. In every case the main products were', 'phenols. When ortho-methyl groups were present, methyl cleavage', '(resulting in phenols) became an important reaction. No evidence for', 'formation of anisoles was found in the most favorable case, that of', '1, 2, 3-trimethylbenzene. -', 'After the identity of the primary volatile addition products had', 'been established, kinetic analysis of the relative reactivity (and attend-', 'ant partial rate factors) was made. The logarithm of the partial rate', 'factors gave a satisfactory Hammett relationship when plotted versus', 'ot constants; this confirms the electrophilic nature of oxygen atoms.'] ['x', 'It was also found that the logarithm of the partial rate factors', 'gave a fair straight line when plotted against the calculated ground state', 'electron densities of the aromatic hydrocarbons. This was interpreted', 'as good evidence for an early rate-determining transition state in the', 'o(3p) oxidation of hydrocarbons. The activating effect of methyl groups', 'was found to be a function of their position and number. A plot of calcu-', 'lated reactivity (based upon toluene) versus the experimental reactivity', 'of the polymethylbenzenes as ordinate gives a straight line with a fall-', 'off factor (slope) of o. 84. Linear free energy correlations with related', 'reactions were also found.', 'A kinetic isotope effect H of 1. 14) was determined for', 'an', 'equimolar mixture of benzene and deuterobenzene. This is in agree-', 'ment with the mechanism of o(3p) oxidation of benzene shown below:', 'H', ""+01'P) slow"", 'fast', 'fast', 'H', '-H°', '+H-', 'O', '.', 'OH', 'O.', '""-complex', 'Since the partial rate factors for o(3) correlate well', 'with', 'calculated electron densities of the ground state hydrocarbon, the re-', 'action is believed to have an early transition state. The absence of', 'anisoles argues for two fast steps following T-complex formation rather', 'than an intramolecular hydrogen shift. However, a one-step rearrange'] ['ment from the ""-complex to the product phenol is not ruled out.', 'Oxidation of aromatics via a microwave glow discharge through', 'CO2, O2 or N2O gave substantially different product distributions than', 'did the mercury-nitrous oxide technique. Although benzene and benzo-', 'trifluoride gave only phenols, toluene and para-xylene gave large', 'amounts of side chain oxidation as well as substantial amounts of', 'methyl cleavage. Thus the side chain in toluene was oxidized to give', 'benzaldehyde and benzyl alcohol as well as cleaved to produce phenol.', 'Attempts to determine the side-chain oxidant in the discharge were made;', 'excited aromatic substrate, ozone, o(1D) and o(3p) were considered.', 'The best rationale at this time is that 013p), reacting at a high temper- -', 'ature, is responsible for the observed products.', 'The action of ozone on toluene and cyclohexane received brief', 'attention as did the reaction of o(1D) with cyclohexane. The photode-', 'compositions of various substrates as toluene, nitrobenzene, anisole,', 'chlorobenzene and bromobenzene are also discussed. The possibility', 'of nitrobenzene photolysis as a source of o(³P) was investigated; pre-', 'liminary results imply that 013p) is not the sole oxidizing agent gener- -', 'ated.']"
145,"['xiv', 'SUMMARY', 'In an effort to overcome the mathematical difficulties associated', 'with the solution of nonlinear combustion instability problems, a new', 'approximate method based on the Galerkin method is developed. This', 'method is used to study the nonlinear behavior of combustion driven', 'oscillations in cylindrical combustion chambers in which the liquid', 'propellants are injected uniformiy across the injector face and the', 'combustion process is distributed throughout the combustion chamber.', ""Crocco's time-lag (n, T) hypothesis is used to describe the unsteady"", 'combustion process, and the hot combustion products are assumed to', 'leave the combustion chamber through a quasi-steady nozzle.', 'In a second order analysis the steady state Mach number is', 'assumed to be small and the conservation equations are combined to', 'obtain a single nonlinear partial differential equation which describes', 'the behavior of the velocity potential. The velocity potential is', 'expanded in a series of acoustic modes, each of which is multiplied by', 'an unknown time-dependent coefficient. Using this series and applying', 'the Galerkin orthogonality criteria yields a system of nonlinear', 'ordinary differential equations which are solved numerically. Numerical', 'calculations are used to predict the following phenomena: (1) the', 'final amplitude attained in an unstable engine, (2) ""triggering"" of', 'instability by finite amplitude disturbances in a linearly stable', 'engine, and (3) the shape of the nonlinear pressure waves. The', 'dependence of the resulting oscillation upon the engine parameters is', 'Reproduced with permission of the copyright owner. Further reproduction prohibited without permission.'] ['XV', 'also determined.', 'Restrictions imposed on the second order theory include small', 'Mach number mean flow, irrotational flow, and the presence of waves of', 'moderate amplitude. In order to relax some of these restrictions a', 'third order theory is developed. The resulting conservation equations', 'can no longer be reduced to a single equation governing the behavior of', 'the velocity potential; instead a system of partial differential', 'equations must be solved. Because of the complexity of these equations,', 'the behavior of a single transverse mode is studied by approximating', 'each of the dependent variables as the product of an amplitude function', 'and the spatial dependence of that mode. The resulting solutions are', 'then compared with those obtained from the second order analysis.', 'On the basis of results obtained from the second and third order', 'theories the following nonlinear mechanisms were found to be important', 'in determining the nonlinear stability characteristies of the system', '(1) the transfer of energy between modes, (2) the self-coupling of a', 'mode with itself, and (3) a nonlinear combustion mass source. The self-', 'coupling mechanism was found to be very important in the initiation of', 'triggered instability, while the nonlinear driving mechanism was', 'important in the determination of the final amplitude of triggered', 'instability.', 'Reproduced with permission of the copyright owner. Further reproduction prohibited without permission.']"
