etd_file_id,text
413,"['ABSTRACT', 'Title of Thesis: Minimum-Fuel Attitude Control and', 'Stabilization of an Inertially-Oriented', 'Space Station', 'John Joseph Fearnsides, Doctor of Philosophy, 1971', 'Thesis directed by : Assistant Professor William S. Levine', 'Using Newtonian Mechanics, a mathematical model is', 'derived to represent small motions relative to an inertial', 'reference coordinate system of a large, unsymmetrical, rigid', 'spacecraft in low, circular Earth-orbit. The resulting system', 'equation is a set of- coupled, linear differential equations', 'with periodic coefficients and periodic forcing functions whose', 'state-space representation is given by x = A(t)x + Z (t) where', 'x E R² is the state vector, ( ) ) = A (t+T) is an n x n matrix,', 'z(t) = Z (t+T) € R², and n = 6. The periodicity of the elements', 'of A(t) and two of the elements of Z (t) are due to the effects', ""of the Earth's gravitational field on the unsymmetrical space-"", 'craft. The periodicity of the remaining elements of Z (t) are', 'caused by the aerodynamic torque, which becomes significant', 'because of the size of the vehicle and the density of the', ""Earth's atmosphere in low orbits. The attitude of the space-"", 'craft is kept close to the inertial reference by a set of', 'Reproduced with permission of the copyright owner. Further reproduction prohibited without permission.'] ['reaction-jet thrusters that are physically constrained to', 'produce on-off or bang-bang controls. A minimum-fuel control', 'law u(x, t) is sought.', 'The first main result of this research is the', 'development of the zero-fuel mode; a three-axis oscillatory', 'motion corresponding to the unique, forced periodic solution', 'of the system equation. This motion is then used in lieu', 'of the point x = 0 as a target set for the development of a', 'control law. It is called the zero-fuel mode because,', '(assuming an ideal, deterministic system) once the state of', 'the system is properly initialized by the thrusters no', 'further control action is required. When the parameters of', ""an early model of NASA's Skylab vehicle are substituted into"", 'the system equation, the amplitudes of the oscillations are', 'relatively small and cause no significant reduction in the', ""performance of the spacecraft's mission. In physical terms"", 'the trajectory of the zero-fuel mode is similar to the usual', 'controlled trajectory produced by the thrusters and is viewed', 'as a ""natural"" limit cycle that is produced in part by the', 'aerodynamic torque. In abstract terms this result is shown', 'to be the generalization to nulti-dimensional, coupled', 'periodic systems of a series of recent results on the minimum-', 'fuel control of constant, single-input single-output systems', 'with a constant forcing function.', 'The next phase of the study is concerned with the', 'development of a control law to keep the actual motion of the', 'Reproduced with permission of the copyright owner. Further reproduction prohibited without permission.'] ['system close to the trajectory of the zero-fuel mode. This', 'is especially important for the Skylab model for which motions', 'away from the target set are shown to be unstable. The chosen', 'control law u(y), where u is a piecewise constant function of', 'y and Y a linear function of x, is selected for its ease of', 'implementation and because it produces a feedback system with', 'excellent closed-loop stability properties.', 'A demonstration of the stability of the controlled', 'system is provided by the second main result contained', 'herein: an application of some recent generalizations of', 'Ly apunov Stability Theory by Yoshizawa and LaSalle. In', 'particular, because the selected control law includes a', 'deadband and the open-loop system is unstable, the origin', 'is not a limit set of the controlled motion. In addition,', 'the combination of a bounded controller and open-loop in-', 'stability dictate a finite domain of attraction. However,', 'the above mentioned theory can be used to determine a com-', 'pact set E* that includes the positive limit set of solu-', 'tions of the closed-loop system equation as well as an', 'estimate of the domain of attraction. It is also shown that', 'this theory can be used to provide information on a type of', 'bounded-input, bounded-output stability for many systems.', 'Reproduced with permission of the copyright owner. Further reproduction prohibited without permission.']"
414,"['ABSTRACT', 'Title of Thesis: Finite Difference Solutions of Steady Laminar Flow', 'Through a Pipe Orifice', 'Theo G. Keith, Jr., Doctor of Philosophy 1971', 'Thesis Directed By: Professor James E. A. John', 'In this thesis, numerical solutions of the axisymmetric form of', 'the Navier-Stokes ecuations are obtained for the steady, laminar flow of', 'an imcompressible fluid through a circular pipe orifice plate. The', 'method of solution employs the widely used two field method of Thom which', 'consists of solving two coupled second order partial differential equa-', 'tions for stream function and vorticity. Finite difference solutions of', 'the governing equations are obtained in a rectangular graded mesh. All', 'derivatives are approximated by five point, unevenly spaced, differences', 'which reduce the truncation error involved with the finite difference', 'approximation. In order to reduce round off error, double precision', 'arithmetic is employed throughout the calculations. Both of these fea-', 'tures have been found essential in obtaining accurate results in', 'reasonable lengths of computing time. In the study, a typical solution', 'consumed approximately 15 minutes of UNIVAC 1108 time. However, computer', 'times increased with increasing Reynolds number and decreasing orifice', 'to pipe diameter ratio.', 'Two typest of orifice plate profiles are considered: square edge', 'and sharp edge. The latter type is beveled at 45° in the downstream', 'direction. Orifice to pipe diameter ratios of . 3, .4, .5, .6 and', '.', '.7', 'have been examined for the square-edged plate. In the case of the sharp-', 'edged orifice, a single orifice diameter ratio of .5 was studied.', 'Reproduced with permission of the copyright owner. Further reproduction prohibited without permission.'] ['Solutions were obtained for Reynolds numbers (based on the pipe', 'radius and average fluid velocity in the pipe) from 0 to 12.5. Stream-', 'line patterns and vorticity contours are presented as functions of the', 'Reynolds number. Distributions of velocity, axial pressure drop and', 'wall shear stress are given. Details of recirculations regions, found', 'in front and behind the orifice plate, are shown. Numerically obtained', 'orifice discharge coefficients are found to compare favorably with', 'existing experimental values (within 5% of each other). Generally, the', 'square-edged orifice discharge coefficients are predicted slightly', 'lower than the experimental values while the predicted sharp-edged plate', 'coefficients are slightly larger. Differences in the orifice plate', 'geometry are thought to account for these discrepancies.', 'Reproduced with permission of the copyright owner. Further reproduction prohibited without permission.']"
415,"['ABSTRACT', 'Title of Thesis: George Frederick Root, Pioneer Music Educator:', 'His Contributions to Mass Instruction in Music', 'Polly Hinson Carder, Doctor of Education, 1971', 'Thesis directed by: Professor Rose Marie Grentzer, Chairman,', 'Music Education Division, Department of', 'Music', 'George F. Root was one of the founders of music education', 'in the United States. His contributions to the profession,', 'however, have remained relatively unknown to twentieth century', 'historians. This study examines ways in which he effectively', 'made mass education in music a reality.', 'He was fully involved in the musical life of his society', 'and his time. Important social and cultural changes were in', 'progress, most significant of which was the new relationship', 'of masses of middle class people to education and the arts.', ""These changing social and cultural conditions affected Root's"", 'work as a teacher and contributed to his emergence as a leader', 'in his profession.', 'His teaching was characterized by an attitude of concerned', 'involvement with the musical experiences of the American peo-', 'ple, and by a responsiveness to their musical tastes and abili-', 'ties. He evaluated these tastes and abilities realistically,', ""on the basis of some fifty years' experience in teaching vocal"", 'music classes.', 'Root taught vocal music classes at all levels, from the', 'Reproduced with permission of the copyright owner. Further reproduction prohibited without permission.'] ['grammar school through the seminary and college. He was among', 'the first teachers of public school music classes, and one of', 'the early leaders in the musical convention movement. He', 'established the first normal institute in the country devoted', 'exclusively to the preparation of music teachers.', 'In response to the need for instructional materials, he', 'wrote, composed, or co-authored more than seventy works of', 'book length. Many of these were textbooks for vocal music', ""classes, ranging from children's classes through teacher'"", 'institutes.', 'The study of these textbooks indicates that the song reper-', 'toire Root used in teaching was designed to interest and moti-', 'vate students, and that its selection was determined by a real-', ""istic, practical evaluation of students' tastes and abilities."", ""This study shows also that Root's methodology of teaching was"", 'designed to meet the problems of mass instruction. Active', 'participation in musical exercise on the part of all students', 'was essential. Root arranged instructional information in', 'carefully ordered sequence, and in small increments, to facili-', 'tate learning. His teaching of music theory was functional in', 'the sense that he emphasized practical usage of the traditional', 'system of signs and symbols, as well as the inherent inter-', 'relationships among rhythm, melody, and dynamics.', 'Root provided for the development of several aspects of', 'musicianship, and in two of these areas his teaching was dis-', 'tinctive. He taught harmony largely as aural experience.', 'Students learned the names and functions of constituent chords', 'Reproduced with permission of the copyright owner. Further reproduction prohibited without permission.'] ['or tones in a harmonic progression initially through hearing.', 'He adapted some of the techniques of private vocal pedagogy', 'to the teaching of classes. Among the techniques he emphasized', 'were posture, breathing, diction, and the kinds of vocalizes', 'usually considered appropriate to private voice study. He', 'approached the dynamic aspect of singing through the emotive', 'import of the words to be sung, and provided both exercises', 'and practical instructions for producing vocal tone qualities', 'appropriate to the mood of the words.', 'When Root began his teaching career in 1838, free public', 'education for the children of all Americans was becoming a', 'national goal, and musical instruction in public schools was', 'beginning. By personally teaching thousands of students, by', 'providing instructional materials designed to facilitate mass', 'instruction, and by offering professional training for music', 'teachers, he made vital contributions to the establishment', 'of mass education in music.', 'Reproduced with permission of the copyright owner. Further reproduction prohibited without permission.']"
416,"['ABSTRACT', 'Title of Thesis: Radioiodine Labeled Human IgG and IgG Fraction of', 'Rabbit Anti-Human IgG Serum: The Use of Labeled', 'Antibody as Antibody in Precipitation and Double', 'Antibody Reactions and as Antigen in Precipitation', 'and Double Antibody Radioimmunoassays', 'William Alexander Falkler, Jr., Doctor of Philosophy, 1971', 'Thesis directed by: Dr. Sue-ning Barry', 'Associate Professor', 'Department of Histology and Embryology', 'Radioiodine (1251) labeled antibody has been studied as an antibody', 'in precipitation and double antibody reactions and as an antigen in pre-', 'cipitation and double antibody radioimmunoassays.', 'Rabbit anti-human IgG serum has been iodinated and the effect of', 'increasing chloramine T reaction time on the percentage radioiodine in-', 'corporated studied. The maximum incorporation of radioiodine by the', 'antiserum was 92% and an increase in iodination was proportional to', 'length of reaction with chloramine T in every case but one. Upon elec-', 'trophoresis the antiserum components displayed the following percentages', 'of radioiodine incorporation: albumin (67-76%), gamma globulins (5-10%) ,', 'alpha1.2-globulins (7-12%), and the beta globulins (5-10%). The differ-', 'ences in radioiodine substitution by each fraction during each increase', 'in reaction time with chloramine T was also recorded.', 'Isolation and purification of the IgG fraction of rabbit anti-human', 'IgG serum followed by iodination allowed greater incorporation of radio-', 'iodine into the antibody molecule. Antibodies at levels of 2.0, 1.7,'] ['125', '1.2, 0.39, and 0.31 atoms', '1/molecule were tested for their activity', 'as antibodies and antigens in precipitation and double antibody re-', 'actions under various conditions to promote maximum binding. Only 25%', 'of the labeled antibody would react as an antibody in precipitation', 'tests at these levels of radioiodination, however at these and higher', '125', 'levels (16 atoms', 'I/antibody molecule), the antigenic potential of', 'the labeled antibody was not markedly decreased.', 'Radioimmunoassays were established in which radioiodine labeled', 'human IgG participated as an antigen in a precipitation version with', 'rabbit anti-human IgG serum, and a double antibody version using rab-', 'bit anti-human IgG serum and goat anti-rabbit serum. Human serum IgG', 'concentrations were determined using both the precipitation and double', 'antibody radioimmunoassays and the results compared to concentrations', 'determined by gel diffusion techniques. In every case the radioimmuno-', 'assay revealed serum concentrations greater than those recorded using', 'the gel diffusion technique.']"
417,"['ABSTRACT', 'Title of Thesis: An Application of the Facet-Factorial', 'Approach to Scale Construction in the', 'Development of a Rating Scale for', 'Clarinet Music Performance', 'Harold F. Abeles, Doctor of Philosophy, 1971', 'Thesis directed by: Dr. Charles E. Johnson, Associate', 'Professor of Education', 'The purpose of this study was to examine a technique', 'for the development of performance rating scales to', 'measure achievement in courses where objectives require', 'complex behaviors not easily measurable using paper and', 'pencil achievement tests. A facet-factorial approach', 'to rating scale construction was employed in the develop-', 'ment of rating scales for the evaluation of clarinet', 'music performance.', 'Achievement measures of complex behaviors such as', 'music performance are typically subjective judgments, based', 'on irregular and uncontrolled observations. Because of', 'this, it seemed desirable to structure the evaluations of', 'complex behaviors in order to improve the precision of', 'measurement. This was achieved by constructing a rating', 'scale to evaluate clarinet music performance.', 'The first step in the construction of the clarinet', ""performance rating scale was to sample experts' criticisms""] ['of clarinet performance by having instrumental music', 'teachers write essays descriptive of the aural aspects of', 'a memorable clarinet performance. These essays were then', 'content analyzed and the resulting item pool together with', 'items generated by a literature search were placed on a', 'five-option response scale to be employed by instrumental', 'music teachers to rate one hundred sample junior high', 'clarinet performances. The results of these descriptions', 'were factor analyzed in an attempt to determine the structure', 'of clarinet performance. The five items which were most', 'highly loaded on each of the six resulting factors were', 'selected to define subscales of a thirty item clarinet', 'performance rating scale. The resulting rating scale was', 'employed in the evaluation of ten different performances.', 'The inter-judge reliability of the rating scale was', 'estimated from these administrations. In order to examine', 'criterion-related validity of the rating scales, a global', 'criterion measure was constructed by having judges rate the', 'thirty performances using a paired-comparison procedure.', 'Both zero-order and multiple correlation coefficients', 'between the rating scale and the criterion measure were', 'obtained.', 'The three major results of the study were : 1)', 'a', 'rating scale based upon a six factor structure of clarinet', 'music performance (interpretation, tone, rhythm-continuity,', 'intonation, tempo and articulation) ; 2) high inter-judge'] ['reliability estimates for both the total score (> .90) and', 'scale scores (>.60) for each of the three groups of judges,', 'evaluating three different sets of ten performances, and', '3) criterion-related validity coefficients greater than', '.80 for each of the three different sets of performances.', 'Results of the investigation suggest that the facet-', 'factorial approach to scale construction can be an', 'effective technique for the construction of rating scales', 'to measure complex behaviors such as music performance.', 'The rating scale for the evaluation of clarinet music', 'performance demonstrated both high inter-judge reliability', 'and high criterion-related validity.', 'Further research is recommended to: 1) investigate', 'the musical selection and musical selection by performer', 'interaction variance contributions to reliability and', 'validity; 2) generalize the clarinet performance scale to', 'other instruments and other ability levels; and 3) examine', 'the acet-factorial technique of scale construction in', 'evaluation achievement in other complex behaviors.']"
418,"['ABSTRACT', 'Title of Thesis: Ultrasonic Absorption Study of e-Caprolactam in', 'Cyclohexane Solutions', 'Mostafa M. Emara, Doctor of Philosophy, 1971', 'Thesis directed by: Gordon Atkinson, Professor of Chemistry', 'The ultrasonic absorption technique was used to study the self-', 'association of e-caprolactam in cyclohexane at 6°C, 10°C, 17°C und', '25°C The experimental data were found to fit a single relaxation.', 'This relaxation was due to the presence of chemical equilibrium be-', 'tween monomers and dimers of e-caprolactam. It is shown that the', ""best model to fit the data, consistent with other workers' results,"", 'is the formation of a cyclic dimer in a two-step process. The observed', 'single relaxation was assigned to the first step, formation of the open', 'dimer. Complete kinetic and equilibrium analysis of the first step', 'was possible from the combination of the ultrasonic data and the', 'overall equilibrium constant for the IR data. The equilibrium constants', 'for the second step are also determined.']"
419,"['ABSTRACT', ""Title of Dissertation: SOLDIERS' ORPHAN SCHOOLS OF"", 'PENNSYLVANIA, 1864-1889', 'O. David Gold, Doctor of Philosophy, 1971', 'Thesis directed by: Dr. Gladys A. Wiggin, Professor of', 'Education', ""The Soldiers' Orphan Schools of Pennsylvania were"", 'something new in the history of the United States. This', 'was the first time a state government had undertaken the', 'education and care of children made orphaned by war. For', ""twenty-five years (1864-1889), soldiers' orphans between"", 'the ages of four and sixteen were reared in twelve special', 'orphanages located throughout the Commonwealth. During this', 'time over fifteen thousand children passed through the', 'schools at a cost to the state of over ten million dollars.', 'The schools were founded largely because of the efforts', 'of Andrew Gregg Curtin, governor of Pennsylvania. Curtin', 'seemed to be guided by political motives to do this act of', 'charity. He saw here a way to have the electorate more', 'readily accept his close ties with the most powerful economic', 'force in the state, the Pennsylvania Railroad. A $50,000', 'gift from the railroad got the schools underway. The', 'governor also saw this aid program as a way to successfully'] ['prosecute the Civil War. Curtin did many things to', 'stimulate the morale and patriotism of the fighting men.', 'Having the state care for their children was but another', ""aspect of Curtin's program of military relief."", ""After the Civil War and Governor Curtin's retirement"", 'from office, a different motive guided the operation of', ""the Soldiers' Orphan Schools. They were rationalized in"", 'terms of how they were helping to preserve the order of', 'society. The children were being prepared to become law-', 'abiding and hard working future citizens of the Commonwealth.', 'Practically everything that took place within the schools', 'was directed towards the goals of obedience, discipline', 'and order. In this respect, the educators who administered', 'the schools were reflecting a primary concern common to', 'schoolmen of the era.', ""In 1889, the state decided to close the Soldiers'"", 'Orphan Schools. Three factors contributed to the failure', 'of the institutions. First, the schools failed to provide', 'a satisfactory program of industrial training for their', 'students. Those who administered the system seemed to be', 'more interested in developing moral character than teaching', ""modern work skills. The transfer of the soldiers' orphans"", 'to an industrial training schools wholly owned by the state', 'signified the failure of the original schools to fulfill', 'the need for industrial education.', 'The schools also failed because of their organizational', 'structure. They were private schools under central, state'] ['supervision. However, the state inspectorate failed to', 'keep a strict surveillance of the schools. Moreover, the', 'proprietors of the private institutions were more interested', 'in making profits than serving the needs of their wards. The', 'eventual establishment of a single school under direct state', 'operation suggested that the original half-private, half-', 'public system of orphan relief was at odds with the growing', 'tendency in the latter nineteenth century for the state to', 'take over more control of such relief projects.', 'Thirdly, the schools came to an end becar', 'they', 'unfortunately became involved in the partisan essures of', 'Pennsylvania state politics. Members of the Republican', 'party were closely associated with the school. In the', 'gubernatorial election year of 1886 the Democrats sought', 'to take advantage of this identification of the GOP with', 'the system. The Democrats charged the Republicans with', ""neglecting the welfare of the soldiers' orphans. In turn,"", 'the Republicans accused the Democrats with playing politics', 'with innocent children. Eventually both sides backed off', 'from what became a distasteful political issue. But the', 'damage had been done. There seemed to be just enough truth', 'in the scandalous revelations of the Democrats to call for', 'an end of the system.', 'But the schools had charted a new course in child care.', 'Other northern states emulated the Pennsylvania effort and', ""three still do. The present state facility for veterans'""] ['children at Scotland, Pennsylvania is a direct descendant of', ""the original Soldiers' Orphan Schools. Here, five hundred"", ""soldiers' orphans continue to receive the aid of the state"", 'of Pennsylvania.']"
