etd_file_id,text
253,"['was performed. Surviving performance material indicates thateach player', 'had his own part.', 'In dance music from before 1680 the b. C. usually was performed', 'either by a bass-line instrument alone, or by a chordal instrument alone.', 'Since the three part texture is harmonically complete either alternative', 'makes good sense.', 'A case can be made for doubling the b. c. in chamber sonatas and', 'secular cantatas from after 1675 whether or not a separate part for this', 'purpose existed. The chamber sonata was influenced by the church sonata', 'and adopted contrapuntal procedures characteristic of the latter. Thereby', 'the bass often came to contain important material, and in such cases it', 'would seem appropriate to use a bass-line instrument even when a part', 'is not furnished. Secular songs up to ca. 1675 are acc rapanied by a', 'chordal instrument alone. Developments in opera at this time influences', 'the performance of cantatas. In opera arias, the bass, which earlier', 'had been devoid of melodic interest, now became melodically independent,', 'much like an obbligato part. Opera composers apparently took advantage', 'of the presence of a cello and used it in a soloistic capacity. When similar', 'arias appear in cantatas, a cello, at times, was included there as well,', 'although clearly not as a geniral practice.', 'The bass-line instruments most commonly used were the violone', '(Italian bass gamba, tuned GG - C - F - A -- d - g ), the archlute, and the', 'cello. The North European bass gamba ( = Italian tenor gamba, tuned', 'ii', 'Reproduced with permission of the copyright owner. Further reproduction prohibited without permission.'] [""D - G - - C - e - a - d') was rarely used except for special effects, and then"", 'mostly in opera.', 'When the participation of a bass-line - instrument was desired in', '17 th-century Italian music there would normally be a separate instrumental', 'part for this purpose. In the absence of a separate part, a bass-line', 'instrument may be included in chamber sonatas and secular cantatas', 'from ca. 1675 onwards if the bass is of sufficient contrapuntal importance.', 'Modern notions, and editorial practices, which assume that the b. c.', 'always should be doubled are in error. No general practice of bass-line', 'doubling existed and each individual work therefore has to be considered', 'separately on the basis of usage in that particular musical genre.', ',', 'iii', 'Reproduced with permission of the copyright owner. Further reproduction prohibited without permission.'] ['CHAPTER I', 'A CHALLENGE TO MODERN NOTIONS OF', 'BAROQUE PERFORMANCE PRACTICE', 'One of the basic tenets of basso continuo practice, as understood', 'in the 20th century, is that two instruments are needed for its proper', 'performance: a chordal instrument, such as the harpsichord, organ,', 'or lute, for the realization, and a cello or viola da gamba to sustain and', 'reinforce the bass line. This view is taken for granted in practically', 'all writings on the subject. It is stated in the major dictionaries, in', 'books on music history, and even in texts for music appreciation classes.', 'Nevertheless, it is a view based on surprisingly little evidence. In fact,', 'one may question whether this view ever existed at all in the Baroque', 'period itself. Specifically, the issue to be raised is whether a bass-', 'line instrument was ever an inevitable addition to the chordal instrument.', 'The rationale for using a sustaining bass-line instrument comes', 'from two kinds of sources: statements in the contemporary theoretical', 'literature, and the extra bass parts in certain types of music which', 'seem to confirm these statements. As for the last point, extra bass', 'parts are not found with any regularity when a large repertory is sur-', 'veyed. They are thus somewhat suspect as evidence. It is,e.g., widely', 'recognized that the presence, or absence, of an extra bass part in the', 'so-called trio sonatas is unpredictable, and that the study of this', 'repertory does not lead to clear conclusions one way or the other about', 'Reproduced with permission of the copyright owner. Further reproduction prohibited without permission.']"
254,"['ii.', 'following issues relating to the role of foreign capital in prewar Japanese', 'capital formation: First, the long pattern and investment implications of', 'our capital flow estimates; Second, the impact of foreign capital inflow', 'on private investment during the period where the connection between', 'capital inflow and domestic investment seems strongest, namely, the years', 'between the Russo-Japanese War and World War I (1904-14) i and Third, the', 'broader perspective of capital flow within the framework of the investment', 'spurt.', 'In Chapter I, The Pattern of Capital Movements : Long Term Investment', 'Implications, an analysis of the more aggregate first question is presented', 'centered about the capital flow periodization based on level and trend', 'movements in Ip/GDCF. We then seek to explore the investment implications', 'of this capital flow periodization by a comparison with the Ohkawa-Rosovsky', 'real side, investment spurt periodization, by an analysis of the cyclical', 'or contra cyclical relationship between the gold flows and the trade balance,', 'and, finally, by an examination of the long torm or short term nature of the', 'capital flows. Taken together, this macro data suggests the need to focus', 'on the period 1904-14, the only time when capital inflow appears strongly', 'connected to domestic capital formation.', 'Having singled out the 1904-14 period for its strong investment', 'implications, we will next want to investigate the capital inflow--domestic', 'investment relationship in greater detail. To this end, Chapter II,', 'Capital Inflow in the Second Spurt, 1904-13: The Transfer Mechanism,', 'represents a more disaggregate attempt to relate capital inflow and private', 'investment. Here we first challenge the traditional notion that capital', '\\ inflow was related to a balance of trade deficit, generated in large part', '1'] ['iii.', 'by military imports. Instead, we suggest that the capital inflow of this', 'period can best be linked to the expanding investment of the private', 'sector. To substantiate this connection we offer an explanation of the', 'transfer mechanism from the Rest of the World to the Japanese Central', 'Government via a treatment of movements in gold and specie held abroad.', 'We then examine the Japanese Central Government to Private Sector transfer', 'through a money flow analysis of the relevant economic categories over', 'this period. Finding that there was a large net financial transfer to', 'the Private Sector from the Japanese. Central Government following the', 'conclusion of the Russo-Japanese War, we then conclude by tracing the', 'impact of this transfer by offering two examples at the firm level.', 'In Chapter III, Toward a Broader Perspective: Capital Flow and', 'the Investment Spurt, we try to place our financial side, capital flow', 'pattern in broader perspective by a comparison with the Ohkawa-Rosovsky', 'real-side, investment spurt periodization. Comparing the two we are able', 'to suggest that the large foreign capital inflow of 1904-13 is the key', 'link from their first, concurrent growth investment spurt to their second,', 'differential structure investment spurt.'] ['VT-tOGT THI Ou HEIM', '- NOI HVMETHA NI NOISHOH no FIOU GHL']"
256,"['ii', 'To my wonderful wife, Joen,', 'without whose help, in so many different ways,', 'this dissertation would not be possible.', 'Reproduced with permission of the copyright owner. Further reproduction prohibited without permission.'] ['vii', 'This theorem contains the basic ingredients needed to', 'prove that D can be extended to be a closed, symmetric,', 'monoidal category in the sense of Eilenberg and Kelly', '(cf. 23.8) .', 'Recall that a k-space is a Hausdorff topological', 'space with the property that a subset is closed if its', 'intersection with each compact subset is closed. Let', 'J', 'denote the category of k-spaces and continuous maps; let', 'Jop denote its opposite or dual category; and let', 'C: Jop', 'X', 'D', 'Sets denote the functor such that if', 'X € ob I and E E obD, then C (X,E) equals the set of', 'all continuous functions from X to', 'E.', 'Theorem (cf. 10.1 and 10.6) . There exist functors', 'C: Jop XD', 'D and M: I', 'D such that (1) V o C =', 'c , and (2) for all X € obJ and E € obD , C (X,E)', 'is naturally isomorphic to Hom (M (X) , E) .', 'Corollary (cf. 10.6). Let X be a k-space. Then there', 'exists a continuous map E: X', 'M (X) with the property', 'that if E is a p-complete space and f: X', 'E is a', 'continuous map, then there exists a unique continuous', 'linear map F:', 'M (X)', 'E such that the following diagram', 'commutes:', 'f', 'X', 'E', 'E', 'f', 'M (X)', 'Reproduced with permission of the copyright owner. Further reproduction prohibited without permission.'] ['viii', 'It is known that products exist in J. As a matter', 'of fact, it is known that J can be extended to be a', 'closed, symmetric, monoidal category. Let a: I x J', 'J', 'denote the product functor.', 'Theorem (cf. 23.9 and 23.12) . (1) If x, Y € obJ , then', 'M (x=Y) is naturally isomorphic to M(X)(MM(Y) ; and (2)', 'if', 'X has cardinality one, then M (X) is isomorphic to', 'the scalar field.', 'This last theorem contains the basic ingredients need-', 'ed to prove that M can be extended to be a ""strong"",', 'symmetric, monoidal functor (cf. 23.18). From this, it', 'follows that M will transform any algebraic structure', 'that might occur at the level of J to an analogous al-', 'gebraic structure at the level of D. Thus we have', 'Theorem (cf. 24.24 and 25.10) . Let or and B be cate-', 'gories such that either (a) 01 = k-spaces and B = D-', 'coalgebras; (b) or = k-monoids and B = N-bialgebras; or', '(c) or = k-groups and B = S-Hopf algebras. Then M', 'can be regarded as a functor from or to B. Furthermore', 'there exists a functor R : B or such that if G € obol', 'and H € ob B. then Moro or is naturally isomorphic', 'to Mor (M(G),H) .', 'B', 'Loosely speaking, a 9-algebra is a p-reflexive space', 'together with an associative multiplication and a unit;', 'a', '8-coalgebra is a p-reflexive space together with a co-', 'associative comultiplication and a counit; a A-bialgebra', 'Reproduced with permission of the copyright owner. Further reproduction prohibited without permission.'] ['ix', 'is a p-reflexive space which simultaneously has the struc-', 'ture of a D - -algebra and a D -coalgebra with the property', 'that the comultiplication and counit maps are -algebra', 'morphisms; and a O-Hopf algebra is a R-bialgebra which', 'admits an antipode. k-monoids and k-groups are k-spaces', 'which satisfy the axioms of topological monoids and topo-', 'logical groups respectively, except that the k-space pro-', 'duct is used in the axioms in place of the usual product.', 'Finally, I would like to mention a result only peri-', 'pherally related to the preceding. A p-reflexive space', 'E will be called a dF space if there exists a Frechet', ""space H such that E is D -isomorphic - to H', where"", ""H' has the topology of precompact convergence. The con-"", 'cept of dF space enables me to prove a generalization of', 'the Banach-Dieudonne theorem.', 'Theorem (cf. 8.6). Let E be a metrizable locally con-', 'vex space and F be a dF space. Then the topology of', 'precompact convergence is the finest topology on hom (E,F)', 'which gives to each equicontinuous, pointwise precompact', 'subset of hom (E,F) the same relative topology as the', 'topology of pointwise convergence.', 'Reproduced with permission of the copyright owner. Further reproduction prohibited without permission.'] ['X', 'Guide to the Reader', '1.', 'In this paper, the following conventions will', 'be used:', '[14] will refer to item 14 in the bibliography;', '15.6 will refer to the sixth item in section 15 of', 'this paper;', 'C7 will refer to the seventh item in appendix C.', '23.4b will refer to the second numbered item in the', 'proof of 23.4; and', '""iff"" will mean ""if and only if"".', '2. I have made an attempt to give a rather complete', 'logical development of everything I do. As a result,', 'many of the propositions which I state and prove are tri-', 'vial and/or well-known. While an attempt is made to', 'attribute important ideas, in many cases I have felt it', 'unnecessary to state that a particular result is trivial', 'and/or ell-known. Thus if a proposition has no attribu-', 'tion, it should not be assumed (1) that the result is', 'original with me, or (2) that I attach any value to it.', '3. The primary goal of this paper is the group of', 'theorems relating k-groups and 8-Hopf algebras, i.e.', 'theorems 24.24, 25.7, and 25.10. Following is a graph', 'indicating the shortest route to these theorems together', 'with the logical interdependence of the sections which', 'lead to them:', 'Reproduced with permission of the copyright owner. Further reproduction prohibited without permission.']"
258,"['impact upon certain coastal areas, especially the port', 'of Cavite and the upland-interior regions. Chapter IV', 'takes up in detail the effects of the Conquest upon', 'man-land relationships in the province: the emergence', 'of the friar estates in Cavite and how these func-', 'tioned. Chapter V considers the effects of nineteenth', 'century changes upon Cavite such as the opening of the', 'Suez Canal, therabolition of the Manila-Acapulco trade,', 'the acquisition of Mexican independence. In Chapter', 'VI, I have tried to describe the ordering of Caviteno', 'society in terms of social classes. I have been mainly', 'concerned hére with defining the existence of an embry-', 'onic middle class in Cavite and its implications upon', ""the reform and revolutionary movements of the 1880's-"", ""1890's. Chapter VII describes existing conditions in"", 'the province immediately before the outbreak of the', 'revolution in 1896. Chapter VIII summarizes my conclu-', 'sions.', 'iv', 'Reproduced with permission of the copyright owner. Further reproduction prohibited without permission.'] ['PREFACE', 'Rather than follow the overwhelming tendency of', 'many students of Philippine history to write about the', 'political history of the country, often in the form of', 'biographies, studies of the Philippine revolution, the', 'Japanese occupation and the like, II have decided to con-', 'centrate upon a slightly different aspect: the colonial', 'history of one Philippine province. Using a consider-', 'ably reduced unit of investigation, I have focused on', 'the process of socio-economic change in the province of', 'Cavite during the Spanish colonial period insofar as', 'such changes could be documented. Besides providing an', 'opportunity for a shift in emphasis, my study has also', 'given me an excellent chance to look at change, not as', 'it is unilaterally dictated and imposed from above by', 'the Great City-with its host of officials, bureaucrats', 'and merchants--but as it is finally accepted, rejected,', 'or manifestly modified in its implementation in the', 'towns and villages, either through the very conditions', 'of life in those areas or through the option of the', 'provincial folk.', 'The difficulties have been many . First of all, the', 'V', 'Reproduced with permission of the copyright owner. Further reproduction prohibited without permission.']"
259,"['genera. Taxonomic differences between the sites are attributable', 'to the biogeographic settings of the sites and to the isolation of', 'Chile. Patterns of ant - habitat association along a 2,000 m', 'elevational gradient are similar in the two regions. A major', 'difference between ant communities in the two regions is the three-', 'fold greater number of species in the California sites. The low', 'number of species in Chile probably reflects both the influence of', 'biogeographic isolation and low species packing. Low species', 'packing in Chile may be attributable to low between-year predict-', 'ability of rainfall. California species may be more closely', 'packed than those of Chile in association with greater amplitude of', 'daily and within-year temperature fluctuation (with a predictable', 'pattern) than in Chile. Consequences of high species packing are', 'greater difference among similar habitats in both number of species', 'and species composition of the community. This study indicates', 'that both consequences are expressed in California but not in Chile.', 'Approved', 'RKCbell', 'August 28,1973', 'V', 'Reproduced with permission of the copyright owner. Further reproduction prohibited without permission.'] ['ACKNOWLEDGMENTS', 'The research reported here was done during a program of grad-', 'uate studies. As in any research of this nature, and particularly', 'in a field study of this geographic breadth and of more than two', ""years' duration, I have relied heavily upon the encouragement,"", 'assistance and advice of my academic mentors, my fellow students,', 'and on many other friends. The list of friends who merit my', 'thanks is very long indeed. The following persons, though, are a', 'few among the many to whom I owe a special measure of gratitude.', 'Daniel H. Janzen first suggested that I merge my proposed', 'studies on ants with the Mediterranean Scrub Project of the', 'International Biological Program. Harold A. Mooney and Otto T.', 'Solbrig, coordinators of the Mediterranean Scrub and Desert Scrub', 'Projects made me welcome on the research team, and they have con-', 'tinued to arrange adequate financial support for me and for my', 'Berkeley associates who have participated in the MSP. That fund-', 'ing has been under NSF grant GB-31195A1 to Robert K. Colwell.', 'Ken Owen and Katy Carter of the Berkeley Zoology Department busi-', 'ness staff deserve special thanks for their assistance with finan-', 'cial matters.', 'The necessity to do extended field work away from my home', 'university has placed demands for logistic support on persons near', 'the research sites. In this regard I extend my sincerest thanks', 'to Albert M. Johnson and Philip C. Miller and their staff associates', 'at California State University at San Diego and to Ernst R. Hajek', 'and Jochen Kummerow and their staff associates at Universidad', 'Catolica de Chile, Santiago.', 'vi', 'Reproduced with permission of the copyright owner. Further reproduction prohibited without permission.']"
260,"['II a', 'x', 'be more consistent with a concerted mechanism for the', 'rearrangement of 32 to 4 than with the stepwise mechan-', 'isms that have been proposed.', 'Reproduced with permission of the copyright owner. Further reproduction prohibited without permission.'] ['iv', 'Table of Contents', 'Abstract.', '11', 'Part I.', 'I. INTRODUCTION', '1', 'Nonclassical 1ons', '1', 'Strained ring systems', '1', 'Strained nonclassical 1ons', '2', 'The energy salvage principle: Examples', '2', 'The quadricyolylcarbinyl system', '4', 'II. POSSIBLE REARRANGEMENTS', '5', 'No rearrangement', '6', 'Hydride shift', '6', 'Expansion to a 5-membered ring', '7', 'Cyclopropylethyl - cyclopropylethyl', 'interconversion', '7', '1,2 Alkyl shift', '15', 'Predicted products from each rearrangement.', '19', 'III. SYNTHESIS', '20', 'Grignard route', '20', 'Displacements', '20', 'Routes involving quadricyclanone', '21', 'Routes using norbornadiene iron tricarbonyl .', '27', 'Synthesis via ?-benzyloxymethylnorbornenone .', '30', 'Quadricyclyl-7-carbinol', '41', 'IV. RESULTS', '43', 'Solvolysis of the brosylate', '43', 'Rate estimation', '44', 'Product mixture from brosylate acetolysis', '45', 'Reproduced with permission of the copyright owner. Further reproduction prohibited without permission.']"
262,"['iii', 'various kinds of social behaviors was noted. The children were then', 'given six tests assessing aspects of social knowledge (e.g., know-', 'ledge of sex-role norms, role-taking ability, moral judgment) and', 'I', 'four tests assessing ability to organize and classify physical materials.', 'Scores for each type of test were summed to form two summary test', 'scores. In addition, ratings were made of the general quality of', 'social behavior (e.g., peer-leadership, forcefulness) and a socio-', 'metric index of peer-popularity was obtained. Finally, a question-', 'naire was administered to parents assessing expectations for auto-', 'nomy and outgoing socialness and preferences for sociability over', 'self-reliance.', 'Children who spent relatively more time in play with objects', 'than people were found (as expected) to perform better on tests of', 'ability to organize and classify physical materials. Children who', 'spent relatively more time in play with people than objects, however,', 'did not perform better on tests of social knowledge. Instead, higher', 'scores on these social tests were related to higher ratings on the', 'quality of social functioning and to greater popularity among peers.', 'Thus, scores on the social tests related to quality, rather than', 'quantity, of social interactions.', 'The social behavior of children differing in orientation was also', 'examined. The most striking difference was that children who show-', 'ed greater relative interest in objects engaged in considerably fewer', 'interactions with peers (as would be expected) but more interactions', 'Reproduced with permission of the copyright owner. Further reproduction prohibited without permission.'] ['iv', 'with adults. Further analysis showed that the greater adult directed-', 'ness of these children did not account for their interest in objects nor', 'for their higher scores on tests of ability with physical materials.', 'No important sex-differences were found; however, birth-order', 'effects were found for several variables. The most important was', 'that first-born and only children showed greater relative interest', 'in people compared to later-born children.', 'Only a chance number of relationships was found between paren-', ""tal attitudes and children's behavior."", 'A tentative conceptual model was presented to account for rela-', 'tionships among intellectual abilities, orientation, and other aspects', 'of social behavior. According to this model, interest in the inanimate', 'environment interacts with knowledge of physical objects in a dyna-', 'mic manner, growth in one leading to growth in the other. That is,', 'differentiated concepts of the physical world lead to interest in envir-', 'onmental events that deviate somewhat from these concepts; attention', 'to these deviations leads in turn to still greater differention of con-', 'cepts. In a similar manner, quality of social behavior may interact', 'with extent of social knowledge. That is, well-developed concepts', 'of the social world presumably assist children in forming satisfying', 'relationships with others; conversely, more positive feedback from', 'other people is likely to provide a more favorable climate for social', 'learning.', 'Reproduced with permission of the copyright owner. Further reproduction prohibited without permission.'] ['V', 'TABLE OF CONTENTS', 'Page', 'I.', 'Background', '1', 'A. Interactions with the social vs. the', 'physical environment', '3', 'B. Some reasons to expect intellectual', 'differences among children with different', 'orientations', '4', 'C. Concept of People vs. Object Orientation', '7', 'D. The ontogeny of people and object', 'orientation', '10', 'E. Focus on the preschool age period', '12', 'II. Review of the literature', '14', 'A. Theoretical concepts', '14', 'B. Empirical literature', '16', '1. Specific social characteristics', '16', '2. Social orientation', '18', '3. Parental influence', '19', 'III. Predictions and exploratory questions', '22', 'A. Predicted relationships', '22', 'B. Exploratory questions', '22', 'IV. Method', '24', 'A. Subjects', '24', 'B. Procedure', '25', 'C. Observational measures', '26', 'D. Tests of knowledge of the physical', 'environment', '31', 'E. Tests of knowledge of the sociai', 'environment', '33', 'F.', 'Parental questionnaire', '40', 'G.', 'Other measures', '43', '1. Popularity among peers', '43', '2. Ratings', '44', 'Reproduced with permission of the copyright owner. Further reproduction prohibited without permission.']"
267,"['-iii-', 'FAR INFRARED SPECTROMETRY OF THE', 'COSMIC BACKGROUND RADIATION', 'Contents', 'Abstract', 'ii', 'I. Introduction', '1', 'A. Theory of the Background Radiation', '2', '1. Big Bang Theory', '2', '2. Primeval Perturbations', '3', '3. Later Perturbations', '5', '4. Recent Perturbations', '5', 'B. Observations', '6', '1.', 'Long Wavelength Direct Observations', '7', '2.', 'Short Wavelength Indirect Measurements', '8', '3. Short Wavelength Direct Observations', '10', 'C. Organization of the Thesis', '15', 'II. Ground Based Observations with a Fabry-Perot Interferometer', '17', 'A.', 'The Problem', '17', 'B.', 'Experimental Design', '18', '1. Theory of Fabry-Perot Interferometers', '21', '2.', 'Properties of 1-d Grids', '23', '3. Construction and Operation of the Fabry-Perot', 'Plates', '25', '4. Aligning and Testing the Etalons', '29', '5. Low Pass Filters', '33', '6. Geometrical Optics: Lenses', '35', '7.', 'Conical Light Condensers', '38', '8.', 'Detector Optimization', '42', '&', 'Reproduced with permission of the copyright owner. Further reproduction prohibited without permission.']"
